sorry,You apologize to everyone. Sorry!,You apologize to (Target). Sorry!,(Player) apologizes to everyone. Sorry!,(Player) apologizes to (Target). Sorry!
spit,You spit on the ground.,You spit on (Target).,(Player) spits on the ground.,(Player) spits on (Target).
spoon,You need to be cuddled.,You cuddle up against (Target).,(Player) needs to be cuddled.,(Player) cuddles up against (Target).
stare,,You stare (Target) down.,,(Player) stares (Target) down.
stink,"You smell the air around you. Wow, someone stinks!","(Target) smells (Target). Wow, someone stinks!","(Player) smells the air around them. Wow, someone stinks!","(Player) smells (Target). Wow, someone stinks!"
strong,You flex your muscles. Oooooh so strong!,You flex at (Target). Oooooh so strong!,(Player) flexes their muscles. Oooooh so strong!,(Player) flexes at (Target). Oooooh so strong!
strut,"With arms flapping, you strut around. Cluck, Cluck, Chicken!","With arms flapping, you strut around (Target). Cluck, Cluck, Chicken!","With arms flapping, (Player) struts around. Cluck, Cluck, Chicken!","With arms flapping, (Player) struts around (Target). Cluck, Cluck, Chicken!"
surprised,You are so surprised!,You are suprised by (Target)'s actions.,(Player) is so surprised!,(Player) is surprised by (Target)'s actions.
surrender,You surrender to your opponents.,You surrender before (Target). Such is the agony of defeat...,(Player) surrendered to their opponents.,(Player) surrenders bef
tap,You tap your foot. Hurry up already!,You tap your foot as you wait for (Target).,(Player) taps their foot. Hurry up already!,(Player) taps their foot as they wait for (Target).
taunt,You taunt everyone around you. Bring it fools!,You make a taunting gesture at (Target). Bring it!,(Player) taunts everyone around them. Bring it fools!,(Player) makes a taunting gesture at (Target). Bring it!
tease,You are such a tease.,You tease (Target).,(Player) is such a tease.,(Player) teases (Target).
thank,You thank everyone around you.,You thank (Target).,(Player) thanks everyone around them.,(Player) thanks (Target).
thanks,You thank everyone around you.,You thank (Target).,(Player) thanks everyone around them.,(Player) thanks (Target).
thirsty,You are so thirsty. Can anyone spare a drink?,You let (Target) know you are thirsty. Spare a drink?,(Player) is so thirsty.,(Player) lets (Target) know they are thirsty. Spare a drink?
threat,You threaten everyone with the wrath of doom.,You threaten (Target) with the wrath of doom.,(Player) threatens everyone with the wrath of doom.,(Player) threatens (Target) with the wrath of doom.
threaten,You threaten everyone with the wrath of doom.,You threaten (Target) with the wrath of doom.,(Player) threatens everyone with the wrath of doom.,(Player) threatens (Target) with the wrath of doom.
tickle,You want to be tickled. Hee hee!,You tickle (Target). Hee hee!,(Player) wants to be tickled. Hee hee!,(Player) tickles (Target). Hee hee!
tired,You let everyone know that you are tired.,You let (Target) know that you are tired.,(Player) lets everyone know that they are tired.,(Player) lets (Target) know that they are tired.
ty,You thank everyone around you.,You thank (Target).,(Player) thanks everyone around them.,(Player) thanks (Target).
veto,You veto the motion on the floor.,You veto (Target)'s motion.,(Player) vetos the motion on the floor.,(Player) vetos (Target)'s motion.
victory,You bask in the glory of victory.,You bask in the glory of victory with (Target).,(Player) basks in the glory of victory.,(Player) basks in the glory of victory with (Target).
violin,You begin to play the world's smallest violin.,You play the world's smallest violin for (Target).,(Player) begins to play the world's smallest violin.,(Player) plays the world's smallest violin for (Target).
volunteer,You raise your hand in the air.,You look at (Target) and raise your hand.,(Player) raises their hand in the air.,(Player) looks at (Target) and raises their hand.
wait,You ask everyone to wait.,(Target) asks (Target) to wait.,(Player) asks everyone to wait.,(Player) asks (Target) to wait.
wave,You beckon everyone over to you.,You wave at (Target).,(Player) beckons everyone over to them.,(Player) waves at (Target).
weep,You cry.,You cry on (Target)'s shoulder.,(Player) cries.,(Player) cries on (Target)'s shoulder.
welcome,You welcome everyone.,You welcome (Target).,(Player) welcomes everyone.,(Player) welcomes (Target).
whine,You whine pathetically.,You whine pathetically at (Target).,(Player) whines pathetically.,(Player) whines pathetically at (Target).
whistle,You let forth a sharp whistle.,You whistle at (Target).,(Player) lets forth a sharp whistle.,(Player) whistles at (Target).
wicked,You grin wickedly.,You grin wickedly at (Target).,(Player) grins wickedly.,(Player) grins wickedly at (Target).
wickedly,You grin wickedly.,You grin wickedly at (Target).,(Player) grins wickedly.,(Player) grins wickedly at (Target).
wink,You wink slyly.,You wink slyly at (Target).,(Player) winks slyly.,(Player) winks slyly at (Target).
work,You begin to work.,You work with (Target).,(Player) begins to work.,(Player) works with (Target).
wrath,You threaten everyone with the wrath of doom.,You threaten (Target) with the wrath of doom.,(Player) threatens everyone with the wrath of doom.,(Player) threatens (Target) with the wrath of doom.
yawn,You yawn sleepily.,You yawn sleepily at (Target).,(Player) yawns sleepily.,(Player) yawns sleepily at (Target).
yay,You are filled with happiness!,You are very happy with (Target)!,(Player) is filled with happiness!,(Player) is very happy with (Target)!
yes,You nod.,You nod at (Target).,(Player) nods.,(Player) nods at (Target).